professor_id,professor_name,school,school_id,course,rating,date,comment
359746,Daniel Chiu,University of Washington,1530,CHEM152,3.0,"Aug 3rd, 2006","hard to understand sometimes. really boring power-point based lectures and like most chem classes, lectures weren't very helpful for the tests."
359746,Daniel Chiu,University of Washington,1530,CHEM152,5.0,"Oct 18th, 2005",Very organized. Sometimes he drilled in topics a little too much but theres nothing wrong with that. Good humor and overall a great prof.
359746,Daniel Chiu,University of Washington,1530,CHEM152,3.5,"Sep 1st, 2005",he really does explain things and goes into details in his lectures. it was really refreshing to knoe that he actually explains stuff
359746,Daniel Chiu,University of Washington,1530,CHEM152,1.5,"Aug 24th, 2005",His tests are really hard and you dont learn very much from going to his lectures
359746,Daniel Chiu,University of Washington,1530,CHEM152,2.5,"Jun 10th, 2005","His tests were HARD. He makes you take quizes at the VERY beginning of quiz section. He is Boring, but I don`t think he knows it. He does want you to learn. Word of advice: GET A GOOD TA!"
359746,Daniel Chiu,University of Washington,1530,,5.0,"Jun 4th, 2005","He is very knowledgeable and very ethusiastic about helping students after the lecture. Even though he might seem boring, but his lectures are very clear if you pay close attention. He really cares about how much student learned in his class."
359746,Daniel Chiu,University of Washington,1530,CHEM152,4.0,"May 20th, 2005","Maybe a little boring, but he explained everything really well. The tests wern't too hard, although we could have used more time. The homework was much more reasonable than in 142 also. Overall, not bad."
359746,Daniel Chiu,University of Washington,1530,CHEM152,3.0,"May 9th, 2005","has the monotone voice, but tries to help students to comprehend better. he's a really nice guy as in person, but as professor.. boring. if you read the book, it's not that hard. i think it's the same for chem 152 for any professor."
359746,Daniel Chiu,University of Washington,1530,CHEM152,3.5,"May 7th, 2005","His voice makes me sleepy in lecture, and he stays on the SAME slide for the longest time. However, he does try to make the material easier to comprehend."
359746,Daniel Chiu,University of Washington,1530,CHEM152,1.0,"Oct 18th, 2004","Lectures impossible to pay attention in. Admitted to making the practice exams very different from the real ones to confuse students, after I had studied so hard, made class difficult and frustrating."
359746,Daniel Chiu,University of Washington,1530,CHEM152,2.0,"May 1st, 2004","Can't concentrate in his class, developed ADD."
359746,Daniel Chiu,University of Washington,1530,CHEM152,3.0,"Mar 12th, 2004","Lectures kind of frustrating, boring and nothing much more than what can be found in book. But decent."
359746,Daniel Chiu,University of Washington,1530,CHEM152,3.0,"Feb 29th, 2004",The lectures don't tach a whole lot. I learned a lot more out of the book than from the prof.
