professor_id,professor_name,school,school_id,course,rating,date,comment
359746,Daniel Chiu,University of Washington,1530,CHEM152,5.0,"Feb 28th, 2026","This man Chiu is the goat. This class got me going from border line depressed, to realizing how good I have it with Chiu as my Chem prof. I once had a dream that this guy made us take the worst chem test ever. Thats how I knew I was dreaming. This man is truly so inspirational. If loving Chiu is wrong, I dont want to be right."
359746,Daniel Chiu,University of Washington,1530,,5.0,"Feb 28th, 2026","Where do I even start... I am so glad I got this man as my prof. This guy is very respectable and seems like a good man. His practice tests are super helpful, and he is willing to help us learn. Also, I loved the in-class activities."
359746,Daniel Chiu,University of Washington,1530,CHEM152,5.0,"Feb 28th, 2026","Highly recommend. Great guy, chill, absolute GOAT"
359746,Daniel Chiu,University of Washington,1530,,5.0,"Feb 28th, 2026","This guy was awesome. Very chill. His tests are very similar to the practice tests. Also, for most of his lectures he did in-class demos which were awesome. Highly recommend."
359746,Daniel Chiu,University of Washington,1530,CHEM152,5.0,"Feb 28th, 2026",Attendance: Not Mandatory
359746,Daniel Chiu,University of Washington,1530,CHEM152,2.0,"Feb 24th, 2026","His lectures are very confusing and unclear. He somehow goes both too slow and too fast at the same time, and jumps around slides before you can finish reading them. His tests were fair in my opinion. The questions are free response word problems and don't test you on conceptual ideas/definitions, just practice problems. Not a great teacher overall"
359746,Daniel Chiu,University of Washington,1530,CHEM152,1.0,"Jan 26th, 2026",Attendance: Not Mandatory
359746,Daniel Chiu,University of Washington,1530,CHEM152,5.0,"Aug 26th, 2025",Chem 152 is a very information-heavy subject and the lectures reflect this. Highly recommend attending lecture as the course is fast paced and dense. I personally did not use the textbook but many others recommend to read. Practice tests accurately reflect exam material. Lectures can get boring so make sure you pay attention.
359746,Daniel Chiu,University of Washington,1530,CHEM152,1.0,"Aug 4th, 2025",Hardest exams I've ever seen. The grading was only determined by the exams as well as only like 10% for aleks. Lectures are very hard to follow as well. Overall a terrible experience 0/10 would not recommended if you can get any other professor try to.
359746,Daniel Chiu,University of Washington,1530,CHEM152,4.0,"Jun 10th, 2025",His lectures can be hard to follow at times but if you are actively listening he makes sense. I have ADHD and so at times this is hard but the material/questions he goes over in class and the material we are given in quiz section are genuinely representative of the questions we are asked on exams.
359746,Daniel Chiu,University of Washington,1530,CHEM152,5.0,"May 21st, 2025","Daniel Chiu teaches at a fast pace but if you keep up with the reading, pay attention in lecture, AND DO WHAT HE SAYS, you will do fine. He repeated over and over again to practice problems as preparation, and he seems to take his test questions from the back of the book problems which he led us to do. Very manageable, but definitely still hard."
359746,Daniel Chiu,University of Washington,1530,CHEM152,3.0,"Apr 22nd, 2025","Lectures are pretty boring but not required. Keep up with ALEKs and you should be good, make sure you do a LOT of review though to be able to solve all types of questions. Start making your note sheet for the exams early on so you don't get confused. Also study using the worksheets. Exams are difficult, make sure you understand the concepts."
359746,Daniel Chiu,University of Washington,1530,CHEM152,1.0,"Apr 8th, 2025",Lectures are hard to follow and stay engaged in. Explanations are surface level and lots of extra work and self-teaching is needed outside of class to keep up. Tests are all free response and usually pretty tricky in regard to set up.
359746,Daniel Chiu,University of Washington,1530,CHEM152,3.0,"Mar 31st, 2025","Lectures aren't great and the class requires outside work to keep up. That being said, tests are fair and align well with class material. They're difficult tests but partial credit is generous. Unfortunately, the textbook is going to be one of your best resources. As long as you keep up with the content, you should do fine."
359746,Daniel Chiu,University of Washington,1530,CHEM152,2.0,"Mar 31st, 2025","This is a lecture heavy course. If you're confused on a concept during that lecture, he doesn't walk through it. Heto throw everything up on the slides at once and expects you to follow. What I did love about his class is that he allows a full sheat of paper, front and back for both midterms. For the final two pages front/back."
359746,Daniel Chiu,University of Washington,1530,CHEM152,3.0,"Mar 26th, 2025","Just read off slides for lecture, tests were difficult, and TAs took weeks to respond to Ed. He is a funny person though and seems really nice, it's just the tests that give him the bad rep. Gives a light ALEKS load and allows cheat sheets on exams."
359746,Daniel Chiu,University of Washington,1530,CHEM152,3.0,"Mar 25th, 2025","The class was alright, the lectures were interesting at the beginning but they got boring due to his monotone voice. He does have good demos and he makes a couple jokes but the exams can be somewhat difficult. He does not respond in the ED Discussions so TA's are lifesavers."
359746,Daniel Chiu,University of Washington,1530,CHEM152,4.0,"Mar 24th, 2025","Not the greatest lecturer, but the demos in class are really fun. Follow his advice and do lots of practice problems from the book. The tests are pretty similar to those problems. If you do plenty of practice beyond just aleks, you will do fine. Overall, I think what people say on here is fair, but he doesn't deserve the hate."
359746,Daniel Chiu,University of Washington,1530,CHEM152,3.0,"Mar 24th, 2025",Daniel Chiu is a funny professor that doesn't deserve the hate he gets. The tests are frqs and always similar to the end of chapter problems. He isn't the greatest lecturer but his office hours are invaluable. As long as you read the book and do practice problems you will do good in his class.
359746,Daniel Chiu,University of Washington,1530,CHEM152,1.0,"Mar 23rd, 2025","Nice guy but bad at explaining concepts, lectures are not engaging. Tests are really hard and questions are written confusing. He will include questions not covered in lecture on the test. Avoid if u can"
359746,Daniel Chiu,University of Washington,1530,CHEM152,1.0,"Mar 22nd, 2025",He doesn't teach well at all. He just reads off the slides he has. I learned more from the homework and labs. The practice exams don't help for the tests and sometimes problems on the tests are things that weren't discussed or taught how to solve. Avoid him if you can
359746,Daniel Chiu,University of Washington,1530,CHEM152,1.0,"Mar 21st, 2025","exams were confusing and not what you expect he expects you to answer them a certain way. Nice guy but lectures were slow and boring, he is not the best at explaining things in lecture."
359746,Daniel Chiu,University of Washington,1530,CHEM152,1.0,"Mar 19th, 2025",Professor Chiu was a very boring lecturer so go to lectures even if you're gonna fall asleep. His exams were pretty difficult and he expected you to solve each problem his way even if there happened to be another way. He didn't seem to care if his students were learning or understanding the concepts. Questions on ed-discussion were rarely answered.
359746,Daniel Chiu,University of Washington,1530,CHEM152,2.0,"Mar 18th, 2025","Chem 152 Spring 2024-2025 Exams were very difficult, lots of curveballs. Very test heavy. There were only 5 FRQ questions on each of both midterms & 9 on the finals and didn't even give any practice material for the finals. Class is also curved. Sometimes TAs take a while to reply on ED Discussion. 1-2 weeks before finals no TAs replied on ED."
359746,Daniel Chiu,University of Washington,1530,CHEM152,1.0,"Mar 17th, 2025",You're better off self-studying than attending ANY of his lectures.
359746,Daniel Chiu,University of Washington,1530,CHEM152,3.0,"Mar 17th, 2025","Not the greatest lecturer but is incredibly helpful during office hours, if you struggle with anything do not be afraid to approach him! A really sweet guy but his lectures could be better, he goes over practice problems quite quickly so you'll definitely want to review things outside of class. Has a ton of fun demos though!"
359746,Daniel Chiu,University of Washington,1530,CHEM152,3.0,"Mar 15th, 2025","this class is just really hard. Dr. Chiu is really kind you can't even be mad if you do bad because he is so willing to explain things, talk to him at the end of lecture and go to office hours! he will offer you help, you just have to go get it. lectures can be slow but he will do demos sometimes. nice dude hard class don't fall behind"
359746,Daniel Chiu,University of Washington,1530,CHEM152,2.0,"Mar 11th, 2025","I taught myself through the textbook because while he does practice problems, for the overall topics, he doesn't rlly explain what it all means. this is also the first class i ever fell asleep in so hes quite a boring lecturer. But he does like to answer questions during office hours so dont be scared to go. Overall id try to find another prof"
359746,Daniel Chiu,University of Washington,1530,CHEM152,3.0,"Mar 8th, 2025","Lectures can be a bit slow sometimes, but he does demos in class to try and keep it engaging. Sometimes explanations are a little unclear and not thorough enough, but if you ask at the end of class he will always clarify really well. Really easy to ask questions to though and overall nice guy! Keep up with lectures and aleks and you're good."
359746,Daniel Chiu,University of Washington,1530,CHEM152,2.0,"Mar 6th, 2025",Chill dude but honestly not good at lecturing. I go to lectures and then review them and still somehow end up having to teach myself everything. He does demos which makes it better. He's funny at least but not good for learning basics I think. Avoid for gen chem.
359746,Daniel Chiu,University of Washington,1530,CHEM152,2.0,"Mar 5th, 2025",He's ight. Lectures are boring but so is chem 152. He does demos and tries to make the class more engaging which is nice. Tests are hard and lots of aleks. You kind of have to sell learn a lot specially for tests.
359746,Daniel Chiu,University of Washington,1530,CHEM152,4.0,"Mar 5th, 2025","not the nicest gen chem professor, but he's sweet and tests are doable even if you don't study hard. always have fun demo before the end of lecture. never went to his office hour so i thought i would get a 35 on a midterm but it turns out that i got a 80. his rubric save my life so take him if you can."
359746,Daniel Chiu,University of Washington,1530,CHEM152,1.0,"Mar 5th, 2025","Lecture materials are very shallow and given examples don't really help with learning topics - Tests are unlike the one practice test given & much more difficult, Homework is tedious, abundant, and overwhelming. Expect to be learning on your own time, and foregoing time with friends to complete absurd amounts of ALEKS modules. Just don't."
359746,Daniel Chiu,University of Washington,1530,CHEM152,3.0,"Feb 27th, 2025",Attendance: Not Mandatory
359746,Daniel Chiu,University of Washington,1530,CHEM152,3.0,"Feb 26th, 2025",Chiu's lectures are very confusing. He talks very fast and almost brushes right past things and is hard to follow. You are only graded on ALEKS and Exams so there's little chance to boost your grade outside of exams. However he's very sweet and his in class demos are very fun. His practice exams are also very similar to the exams he gives
359746,Daniel Chiu,University of Washington,1530,CHEM152,2.0,"Feb 25th, 2025","Chiu is not a good professer. His tests are hard - which is not what I am complaning about because 152 is a hard course. I will say that his lectures are extremely confusing and hard to follow. He doesn't explain concepts well, is always rushing, and glosses over practice problems. Take 152 with another professer."
359746,Daniel Chiu,University of Washington,1530,CHEM152,1.0,"Feb 17th, 2025",The tests are open note but borderline impossible. He glosses over major concepts and then shows an extremely hard math problem application of it and expects every one to understand. If no one gets it he makes a passive aggressive comment about how we need to figure it out and then moves on. He also makes the ALEKS due at 5pm which is just dumb.
359746,Daniel Chiu,University of Washington,1530,CHEM152,1.0,"Feb 5th, 2025",tests are hard everything else okay for some reason
359746,Daniel Chiu,University of Washington,1530,CHEM152,4.0,"Dec 16th, 2024","Chemistry 152 is a tough course, but Professor Chiu's engaging demos and jokes make the class more bearable. Though his lectures can be rushed, his willingness to help in office hours is invaluable. unstuck ai's practice problems were a lifesaver for exam prep."
359746,Daniel Chiu,University of Washington,1530,CHEM152,4.0,"May 9th, 2024","152 is the hardest gen chem class but Chiu probably isnt to blame. Hes down to earth and in office hours hes great. Lectures may make you want to fall asleep, but his demos are fun, and at least hes easy to talk to. Still a demanding prof and class tho (Final average was 89/200, with a little studying i got 135)."
359746,Daniel Chiu,University of Washington,1530,CHEM152,5.0,"May 8th, 2024",Lectures are straight forward and tests are well aligned with worksheets in discussion sections and problems from class. He is also very willing to help with any questions you have!
359746,Daniel Chiu,University of Washington,1530,CHEM152,5.0,"Apr 11th, 2024","I personally really liked Dr. Chiu, especially compared to other professors for chemistry here. He is straightforward and clear in his lectures, and still has some sense of humor throughout them. Any class in the chem series is gonna be difficult, fast paced, and have hard tests, and I think that Chiu handles it very well. DONT FALL BEHIND!"
359746,Daniel Chiu,University of Washington,1530,CHEM152,4.0,"Mar 25th, 2024",Chiu is so fun and silly. His lectures can be a little boring sometimes but he does demos that really lighten it up. He makes an effort for all his students to have the capacity to prepare well for exams and is very good at answering questions. I wish I could take this class again! Would recommend.
359746,Daniel Chiu,University of Washington,1530,CHEM152,2.0,"Mar 11th, 2024",Just reads off slides but goes to quick where you can't take notes or understand. Very monotone and not engaging. Have to spend large amount of time teaching myself.
359746,Daniel Chiu,University of Washington,1530,CHEM152,1.0,"Mar 9th, 2024","Lectures are not very engaging and hard to follow. He goes through slides too fast for most people (me) to take notes, and he will do a lot of pointing with his laser instead of truly explaining. Admittedly, the content in this class is hard, but I would recommend taking chem 152 with another professor - you have to teach yourself with this prof."
359746,Daniel Chiu,University of Washington,1530,CHEM152,2.0,"Mar 7th, 2024","Professor Chiu seems like a great and caring guy and is always making jokes and doing demos for the class. However, the good ends there. He should not be lecturing for a class that is already super difficult, because he simply is a terrible lecturer. He rushes through slides and jumps around while rambling on and making the class more confusing."
359746,Daniel Chiu,University of Washington,1530,CHEM152,2.0,"Mar 6th, 2024","not a very good lecturer, you really have to put in time outside of class teaching yourself the material. the textbook is unfortunately one of your best options but reading chem textbooks is very time consuming. lectures honestly don't contribute much because you really need to just copy down the slides (that's all that he does in class)"
359746,Daniel Chiu,University of Washington,1530,CHEM152,2.0,"Jan 10th, 2024","Dry lectures, very little practice tests/additional resources available. You definitely have to work hard to do well in this class but it's doable."
359746,Daniel Chiu,University of Washington,1530,CHEM152,1.0,"Dec 17th, 2023",ALEKS is a nightmare. Barely used textbook. Had to use YouTube to teach myself. Way too many slides and kind of just throws solved problems up expecting you to follow along. Monotone + hard to follow. Quiz sections spent talking about how bad he is. TAs are wonderful and actually care. Better time spent watching tutorials than going to lecture.
359746,Daniel Chiu,University of Washington,1530,CHEM152,5.0,"Dec 12th, 2023","Chemistry 152, thermodynamics, is a tough concept. Professor Chiu does not gloss over complicated concepts; he strives to give his students as full an understanding as possible. He was always willing to go over problems that didn't make sense after class. He won't go easy on you, but he will do everything he can to teach you Chemistry"
359746,Daniel Chiu,University of Washington,1530,CHEM152,1.0,"Nov 30th, 2023","Awful. Lectures not the most helpful, super monotone voice and didn't explain things very well. Provided little to no resources to succeed (one practice midterm per test and the concepts didn't overlap). Tests were extremely difficult, and my most helpful study source was youtube."
359746,Daniel Chiu,University of Washington,1530,CHEM152,5.0,"Dec 21st, 2022",A lot of the hate Prof. Chiu gets is bc chem152 is a hard class. He was always available outside of lecture for extra help and always willing/patient when answering questions. He has plenty of resources to study from for exams/quizzes. Do the book problems and all the practices and you should be fine with the Prof. 152 in general is difficult.
359746,Daniel Chiu,University of Washington,1530,CHEM152,3.0,"Mar 26th, 2022","He is tough, but fair. Requires a lot of work on your own time for practice problems in the book, but doable. Appreciated the weekly tests rather than fewer midterms."
359746,Daniel Chiu,University of Washington,1530,CHEM152,4.0,"Mar 23rd, 2022","Professor Chiu, although difficult was not too bad. He really emphasizes using textbook problems as practice and for studying. Do them! I promise if you do back of the textbook problems consistently then you will do well on this class. Reading the text book also helped me but probably not necessary for all students, I would recommend it though."
359746,Daniel Chiu,University of Washington,1530,CHEM152,1.0,"Jun 26th, 2021","He refused to grade a lot of my tests because I had WiFi issues and submitted slightly after the due time. I contacted the Chem Dept Dean and they agreed with me that I should be allowed to have my tests graded, but he still only graded enough to allow me to pass. My GPA and mental health suffered and he blamed me for things I couldn't control."
359746,Daniel Chiu,University of Washington,1530,CHEM152,3.0,"Mar 21st, 2021","Not an amazing lecturer, and his tests were not always lined up with what we were learning at any given moment. However, he did the job he was supposed to and effectively taught chemistry."
359746,Daniel Chiu,University of Washington,1530,CHEM152,4.0,"Mar 16th, 2021","The chem 152 professors decided to ""flip the classroom"" spring quarter which meant we were taught by a different prof each ch. I didn't have Chiu for exams, so I can't speak on those but he was by far my favorite lecturer out of the 7 profs who taught the class. He was clear and concise and kept me engaged. I did the best on the chapters he taught."
359746,Daniel Chiu,University of Washington,1530,CHEM152,2.0,"Mar 11th, 2021","This class really messed up my mental health this quarter. The class is taught by some of the professors in the chem department through pre-recorded lectures so I wouldn't say that Chiu's lecturing is better or worse than any of the other options but his tests are so difficult that no matter how hard you study, you won't get a good score."
359746,Daniel Chiu,University of Washington,1530,CHEM152,1.0,"Mar 3rd, 2021","Vey tough grader. Very quick at answering emails. However, be prepare to read a lot. Expect the tests to be nothing like the ones in the practice problems. Don't take this class if you don't have a strong foundation in chemistry."
359746,Daniel Chiu,University of Washington,1530,CHEM152,1.0,"Jan 26th, 2021",such a boring lecturer. AVOID.
359746,Daniel Chiu,University of Washington,1530,CHEM152,1.0,"May 24th, 2020",I would NOT recommend Chiu for Chem 152. Avoid at all costs. His lectures and quiz sections are very unhelpful and his tests are based on practice problems and all written work. The midterm averages were between 40-50% and the only thing that saved me was the online ALEKS final. I don't think I learned anything with him.
359746,Daniel Chiu,University of Washington,1530,CHEM152,1.0,"Apr 13th, 2020",Chiu's class was extremely hard. His lectures are basically reading off the slides and he barely explained anything important on the exams. Experiments were cool tho. Our grades kept changing after the final grade submission deadline and we weren't even told why and if our grades dropped.
359746,Daniel Chiu,University of Washington,1530,CHEM152,1.0,"Mar 22nd, 2020","Makes explanations way more difficult than they need to be. Average test score was a 40%. Not very understanding. Often his lecture focuses on things you don't need to know, but then he skips over all of the work for the equations and necessary topics. He did post his slides so that was nice."
359746,Daniel Chiu,University of Washington,1530,CHEM152,1.0,"Mar 18th, 2020","First off, reading from slides is not an appropriate way to teach a course like this, and that's all the lectures consisted of. Very few examples to go with them, and when they did pop up in lecture almost no time was spent trying to understand them. So if you don't mind teaching yourself chemistry, take this class. Otherwise, avoid."
359746,Daniel Chiu,University of Washington,1530,CHEM152,1.0,"Mar 14th, 2020","AVOID. If you have to take Chem152 don't take Chiu. His class is almost 70% graded off of 2 midterms and a Final and he is a really harsh grader. Averages for both midterms were incredibly low ( 50% or lower) with many, many people having a grade lower then they deserved. Not much work to do for class (just ALEKS) but tests more than make up for it"
359746,Daniel Chiu,University of Washington,1530,CHEM152,1.0,"Mar 6th, 2020","His tests are pretty tough, all long answer questions. Lectures are also pretty confusing."
359746,Daniel Chiu,University of Washington,1530,CHEM152,5.0,"Apr 21st, 2019",Professor Chiu has clear and straightforward lectures. He also provides practice tests before exams and suggested review topics.
359746,Daniel Chiu,University of Washington,1530,CHEM152,4.0,"Apr 10th, 2019",Daniel Chiu wore the same outfit to class nearly every day. He is an icon of consistency and efficiency. He lectures were OK. Class structure? Great. Be ready for a lot of free response and a lot of fun (sort of).
359746,Daniel Chiu,University of Washington,1530,CHEM152,1.0,"Apr 4th, 2019","He is knowledgeable in his area, sure. He is not a great lecturer, reads straight from slides, doesnt go into details or provide enough sample problems, extremely test heavy. Doesn't give practice final exam. Lectures arent even worth going to bc what he says in class is exactly from the slides that he posts."
359746,Daniel Chiu,University of Washington,1530,CHEM152,3.0,"Mar 25th, 2019","DO THE PRACTICE PROBLEMS. His lectures explain some things well, but often also go over things that you really don't need to know for the class. They can get very boring very easily. The tests are really hard, and require much more knowledge than is presented in lecture. The worksheets are kind of helpful, but not all the time."
359746,Daniel Chiu,University of Washington,1530,CHEM152,3.0,"Mar 24th, 2019","I'm not gonna lie but Chem 152 with Chiu was absolute hell. His lectures are a waste, his worksheets suck, and his tests are really hard. Make sure you do the practice problems he assigns at the end of each chapter cause he puts some of them on his tests. Also, unless you have a STRONG foundation in chemistry, don't take his class."
359746,Daniel Chiu,University of Washington,1530,CHEM152,1.0,"Mar 11th, 2019",Very dry lecturer. Very hard tests. Lectures have examples but are primarily derivations of things you do not need to know.
359746,Daniel Chiu,University of Washington,1530,CHEM152,2.0,"Mar 1st, 2019","Make sure you do the challenge problems and practice problems. Understand how to derive the solution rather than doing the algebra and getting the answer. Chem 152 is supposed to be the hardest class of the series. Whatever professor you get, you will have to work harder just because the content is much harder than chem 142. Try to get Craig."
359746,Daniel Chiu,University of Washington,1530,CHEM152,5.0,"Aug 21st, 2018","Tests are super predictable. You get a sheet of notes for all tests. For the final I figured out what type of problems he'd put on there by looking the the suggested problems. Copied them onto my note sheet and they showed up on the final and I just had to copy it back down. Pulls from worksheets too. Super easy class, super predictable."
