professor_id,professor_name,school,school_id,course,rating,date,comment
359746,Daniel Chiu,University of Washington,1530,CHEM152,1.0,"May 31st, 2018","I did fine in this class but I am here to lay down the truth. If anyone has to take Chiu, it is possible to get a good grade but you must teach yourself entirely from the book. His lectures are taken from the book, not in a good way as most lectures are on how equations were derived which we are not tested on. Do the challenge book problems."
359746,Daniel Chiu,University of Washington,1530,CHEM152,1.0,"May 10th, 2018",Jumps around his lecture slides a ton. Focuses a lot on the derivation of some equations used so it can be very difficult to see what's important from lecture. Exams are not multiple choice which leaves room for a good amount of partial credit (varries by TA). Old exams are VERY similar to current exams and he USED PROBLEMS FROM BOOK ON FINAL!!
359746,Daniel Chiu,University of Washington,1530,CHEM152,1.0,"Apr 30th, 2018","Worst teacher ever, can't lecture. The tests are impossible."
359746,Daniel Chiu,University of Washington,1530,CHEM152,5.0,"Apr 1st, 2018",I really enjoyed 152 with Chiu! I took Craig for 142 and that was the worst class ever. Chiu explains the lectures with a lot of detail and examples . My only complaint was that he intentionally set the mean on the second test really low but overall the tests weren't bad and didn't have surprises if you did all of the suggested practice problems.
359746,Daniel Chiu,University of Washington,1530,CHEM152,1.0,"Mar 26th, 2018","Chiu goes very fast in lecture and though there are a few examples in the slides he mostly flips past them without explanation. There is no panopto, so there is no way to listen to the lectures again. The tests are free response and he expects you to infer how to do problems you've never seen before. Try to do all of the recommended book problems."
359746,Daniel Chiu,University of Washington,1530,GFYW9TCUFL,4.0,"Mar 18th, 2018","In all honesty, it was not too bad. Would recommend the optional practice problems he assigns, but they are helpful. His tests are also all straight forward with NO TRICK QUESTIONS. It was all good in the end even though I fell asleep every lecture lol. Chem is going to be hard no matter the professor, and I am actually glad I took Chiu for 152."
359746,Daniel Chiu,University of Washington,1530,CHEM152,5.0,"Mar 18th, 2018","I disagree with a lot of the reviews here, I'm of those people who prefers Chiu to Craig. I love that his tests are free response, they aren't easy tests but throughout the class he gives you many tips on being successful in his class--LISTEN TO HIM. Especially try doing book problems and worksheet problems on your own."
359746,Daniel Chiu,University of Washington,1530,CHEM152,4.0,"Mar 14th, 2018",Professor Chiu clearly knows his stuff but his lectures are hard to understand/quite dry. Exams are all free response and super hard. The final is basically impossible. Better rely on partial credit to pass.
359746,Daniel Chiu,University of Washington,1530,CHEM152,4.0,"Mar 11th, 2018","Great professor and very knowledgeable, however, his lectures can be confusing if you are seeing the material for the first time. Lectures in thermo focus on reciting equations and the derivations behind them. Read the text ahead of time and come in with a good feel for the topic. Tests are difficult but not impossible. Good luck!"
359746,Daniel Chiu,University of Washington,1530,CHEM152,1.0,"Mar 5th, 2018","I got stuck with him because all other lectures were full. Soon realized that all of the reviews on here are accurate. Cool guy and extremely smart, but doesn't seem to understand that it's most likely our first time seeing this material. Lectures are pretty dry. Tests are extremely tough and usually the review is not useful. Just no."
359746,Daniel Chiu,University of Washington,1530,CHEM152,1.0,"Mar 4th, 2018",I would not recommend taking this class unless you're prepared to ace the hardest exams ever made. The lectures aren't very helpful; the professor basically rewords what is on the powerpoint slides and expects us to understand everything. At least he suggests some practice problems to do. I should have listened to other reviews before signing up!
359746,Daniel Chiu,University of Washington,1530,CHEM152,3.0,"Mar 2nd, 2018","Chiu is obviously a very knowledgeable professor so I have no complaints towards him in terms of lecture. However, his tests are extremely difficult and 100% free response. Tons of practice problems are a necessity to succeed considering that on the average midterm you have to complete 6 hefty problems in 45 minutes."
359746,Daniel Chiu,University of Washington,1530,CHEM152,5.0,"Jan 29th, 2018","I believe Professor Chiu is unfairly rated in this site. He is the greatest professor I have ever met. He taught me not only chemistry, but also the philosophy of science. It's true that his exams are hard. However, if you follow his instructions and study hard, you can see the charms of the exams!"
359746,Daniel Chiu,University of Washington,1530,CHEM152,1.0,"Dec 1st, 2017","His tests are really hard. On the second midterm he put a question that only 2 people got 24 or 25/25 on and the rest got 2 or lower... his final was really hard too as I opened it and looked at the questions, I didn't know how to answer half of them. His lectures are boring as hell, don't go just read the book."
359746,Daniel Chiu,University of Washington,1530,CHEM152,5.0,"Jun 19th, 2017","His tests were crazy hard (all free response, very tough grading), but I still really enjoyed his class. Homework was reasonable. He was hilarious and a great lecturer, and he was always accessible outside of class for questions (either during his office hours or right before/after lecture. DO THE PRACTICE PROBLEMS FROM THE TEXTBOOK THOUGH."
359746,Daniel Chiu,University of Washington,1530,CHEM152,4.0,"May 12th, 2017","This class is obviously tough. It's a bit much to expect a lecturer to make you understand thermo just from a PowerPoint. You need to read and do all the practice problems in this class to do well, and if you do read before lecture, Chiu really helps you solidify what you just learned--he is an amazing professor if you also do your part to learn."
359746,Daniel Chiu,University of Washington,1530,CHEM152,3.0,"Apr 19th, 2017",There was no Panapto recordings for this course so you can't go over the lecture and if you miss class you are screwed (or you can get notes from a friend). The class was pretty challenging and requires practicing questions outside of class.
359746,Daniel Chiu,University of Washington,1530,CHEM152,3.0,"Apr 16th, 2017","I found lectures good to go to, however he essentially reads off his lecture slides and skips around a lot, its better to read the lecture notes before hand. Read out of the book AND DO THE END OF CHAPTER QUESTIONS!!! A difficult Prof but you can be successful if you do the work he assigns. Tests are about 5-6 questions worth about 20 points each"
359746,Daniel Chiu,University of Washington,1530,CHEM152,2.0,"Apr 7th, 2017","Don't remember much but he loves math and equations. 5 or so questions and each about 20 points it was hard for me. His lectures give bare minimum, you really need to keep up by studying the book and getting help. I couldn't tell if he cared about the students learning. Had to retake this class the lowest grade I've ever gotten in any science class"
359746,Daniel Chiu,University of Washington,1530,CHEM152,2.0,"Mar 21st, 2017","I found lectures very boring & not helpful at all. Read the textbook & take good notes, then glance over his lecture notes. Know how to do the quiz section worksheets & then to do good on exams memorize how to do practice problems & the practice test he releases before the exam. You don't need to know content, just how to do math problems."
359746,Daniel Chiu,University of Washington,1530,CHEM152,3.0,"Mar 20th, 2017","While Prof. Chiu's lectures stay close to the text book, reading the assigned chapters is really important. I would say this class was largely self-taught, so don't take this class if you aren't willing to put in a lot of extra time reading the textbook. The tests are challenging but all long-answer so plenty of opportunity for partial credit."
359746,Daniel Chiu,University of Washington,1530,CHEM152,3.0,"Mar 18th, 2017","Chem 152 is a hard class, probably the hardest out of the gen chem series like most people say. I felt Chiu's lectures were a bit confusing, dense, and boring at times, especially when you get into thermodynamics.I took Craig for Chem 142, she's definitely a better lecturer, but no matter who you have for 152, you have to put in effort to succeed"
359746,Daniel Chiu,University of Washington,1530,CHEM152,2.0,"Mar 18th, 2017",Attendance: Not Mandatory
359746,Daniel Chiu,University of Washington,1530,CHEM152,1.0,"Mar 18th, 2017",The only way to pass this class is to write all the book challenge problems on your cheat sheet and hope you get lucky lol
359746,Daniel Chiu,University of Washington,1530,CHEM152,3.0,"Mar 17th, 2017","Chiu's an incredibly smart professor (he went to freaking Stanford and Harvard???) and really knows what he's talking about. He's lectures might seem a little hard to understand, but that's only if you don't read the chapters before hand. Tests are free response. Kind of tough, but not impossible to get a good grade if you do a lot of practice."
359746,Daniel Chiu,University of Washington,1530,CHEM152,3.0,"Mar 16th, 2017","The only advice you'll need for his midterms and final: memorize the practice problems from the book, put it on your cheat sheet, and you're good to go!"
359746,Daniel Chiu,University of Washington,1530,CHEM152,3.0,"Mar 14th, 2017",youre probably gunna have a bad time
359746,Daniel Chiu,University of Washington,1530,CHEM152,4.0,"Mar 13th, 2017","152 is not an easy class. Chiu gives you work sheets and stuff and they're pretty helpful. Tests are pretty and he's not too generous with partial credit, but again, it's a hard class, so you kind of have to expect it."
359746,Daniel Chiu,University of Washington,1530,CHEM152,2.0,"Mar 4th, 2017","The lectures in this class were very boring and often left me more confused than before. He just reads off of the slides, and only shows one way to solve problems that often can be solved in an easier way. His tests are graded incredibly harshly and that is 70% of your grade. Even if you understand everything, getting a good grade is very hard."
359746,Daniel Chiu,University of Washington,1530,CHEM152,4.0,"Sep 7th, 2016",His class was pretty easy! All you have to do is know how to apply the formulae you learn in his class into the questions he asks on the exams (he also allows cheat sheets which are super helpful). He's always open to questions during and after class.
359746,Daniel Chiu,University of Washington,1530,CHEM152,3.0,"May 20th, 2016","While Chiu's lectures are pretty boring, but he outlines basically what he's looking for, working practice problems and sticking really close to the book. His tests are 4-5 free response math/chem problems where you can get partial credit if you write out all your steps, and he gives practice exams that are very very similar to what you'll see."
359746,Daniel Chiu,University of Washington,1530,CHEM152,2.0,"Apr 17th, 2016",Tests are completely free response and throw plenty of curveball questions. Lectures are scrambled and all over the place. He makes good dry humor but at some point its not as funny since his lecture jumps around so much its impossible to take good notes. Back of the book questions and readings are essential to passing this class.
359746,Daniel Chiu,University of Washington,1530,CHEM152,2.0,"Apr 13th, 2016",Chiu always rushed through his lectures. A lot of this class is based on calculations and he'd go over them in class but I would never be able to keep up. Tests were very difficult and he didn't really give you the resources to prepare. That being said I still got a 2.9 and never scored above average on the tests. Make sure you do ALEKS + Labs 100%
359746,Daniel Chiu,University of Washington,1530,CHEM152,3.0,"Mar 24th, 2016",Chem 152 is definitely the hardest of the three introductory chemistry classes. Chiu did a pretty good job of teaching the material and telling us what we needed to know for midterms/final. Be prepared to do a lot of problems from the book.
359746,Daniel Chiu,University of Washington,1530,CHEM152,4.0,"Mar 18th, 2016","Chiu isn't as possible as he might seem. Go to his office hours if you have questions. Do ALL the practice problems and do ALEKS and show up to lab, those are easy points. Make sure you understand the concept behind the practice problems. The practice exams are very similar to the actual exams so prepare for that. Read the textbook and you'll pass."
359746,Daniel Chiu,University of Washington,1530,CHEM152,4.5,"Jun 21st, 2015","Professor Chiu is my favorite professor for chemistry. This guy is a genius. Go to his office hours and ask questions. Seriously. His lecture-style is dry, but hilarious. WAYY better than Craig. He will explain concepts and help you through practice problems in the book, which are ESSENTIAL to doing well on his tests. Don't worry you can do it!"
359746,Daniel Chiu,University of Washington,1530,CHEM152,2.0,"Mar 16th, 2015","He is hard to understand in class. A lot of own reading necessary. No instructions given on what older exams or book problems are good to practice. He did tell us that the final was going to be hard, but not that it was going to be ""unpass'able"". Problems on final wasn't even remotely close to what he taught in class."
359746,Daniel Chiu,University of Washington,1530,CHEM152,3.0,"Mar 14th, 2015","The concepts in 152 are not THAT difficult but despite how much I like this professor as a person, Professor Chiu really makes it tough. I personally found it very difficult to learn in lecture. I would recommend reading the textbook and looking at lectures on your own time if you are a good student."
359746,Daniel Chiu,University of Washington,1530,CHEM152,3.5,"Jan 26th, 2015","Chem is just a hard subject in general. There's nothing really wrong with the way he lectures, he makes things fairly clear in class. He cracks a joke here and there and has fun demonstrations and the difficulty of the tests and homework is quite reasonable."
359746,Daniel Chiu,University of Washington,1530,CHEM152,2.0,"Apr 3rd, 2014","Alright, I bombed the first midterm (48/100 or something). Got below averages on all the tests, and somehow finished with a 2.9...that means you HAVE to do the lab reports well; go to Chem Study Center and collaborate with others and do the ALEKS. You should look at the slides before going to class always, and do all the odd book probs in each chpt"
359746,Daniel Chiu,University of Washington,1530,CHEM152,4.0,"Mar 20th, 2014","Look. Chiu isn't a bad professor. It's college. Yes his powerpoint slides are confusing and often simplified but it's college and you have to study on your own. I did poorly on his 1st midterm, read the book, did ALL the practice problems, then got 100 and the second midterm and passed with a 3.6 in the class. U MUST READ YOUR BOOK TO PASS!!!"
359746,Daniel Chiu,University of Washington,1530,CHEM152,3.0,"Mar 14th, 2014","Overall Chiu was not as bad as I was prepared for. The reviews made it seem awful. He sticks to the book and his slides are clear. He does sometimes get confusing in jumping around on slides. His tests are just similar to his practice tests, with one tricky one on each exam. The allowed 1 cheat sheet is so helpful! Study a lot though from the book!"
359746,Daniel Chiu,University of Washington,1530,CHEM152,1.5,"Dec 4th, 2013",worst chemistry professor I've had. tests are insane. midterms of 6 questions and final of 12. doesn't care about students' learning and reads from slides every lecture. don't need to go to class to do well
359746,Daniel Chiu,University of Washington,1530,CHEM152,1.0,"Jun 7th, 2013",Don't go to lecture. Learn from the book and his online lecture slides and you'll survive. His tests are crazy hard. You need to understand concepts and be able to apply them in all sorts of situations. Chiu don't even know.
359746,Daniel Chiu,University of Washington,1530,CHEM152,2.0,"Apr 17th, 2013","Chiu flips around his slides like somebody would flip through his lecture slides like somebody would flip through the sunday ads. It was much easier to understand the slides when you read them online. Even then, his tests are insane and he doesn't offer much hope. Avoid!"
359746,Daniel Chiu,University of Washington,1530,CHEM152,2.0,"Mar 31st, 2013","To succeed in this class, you must understand all the materials and also the problems given in quiz section. Lectures are boring and useless. Exams are extremely hard but the grades are based on a curve."
359746,Daniel Chiu,University of Washington,1530,CHEM152,2.0,"Mar 23rd, 2013","If your chem background isn't very strong avoid him at all costs! I only went to lecture because I felt bad if I didn't though they're totally useless! His midterms are fair enough, not easy for sure though but, his final was most unreasonable! I was even thankful to know how to BS through his class to make it out alive above a 3.0"
359746,Daniel Chiu,University of Washington,1530,CHEM152,1.0,"Mar 23rd, 2013","As has been said before, his lectures and he are useless. I only did well in this class because I used the textbook. He is fond of asking questions that are not directly covered in the text, nor in his lectures. His midterms were fair, but his final was hilariously unjust. He's a horrible teacher."
359746,Daniel Chiu,University of Washington,1530,CHEM152,2.0,"Mar 20th, 2013","Nothing I can say that hasn't been said already. Unless you already learned all the material in high school, you won't make it out of this class without reading the textbook."
359746,Daniel Chiu,University of Washington,1530,CHEM152,1.0,"Mar 19th, 2013",Chiu is terrible don't take his class. His tests are insane and he just reads off the slides which come straight from the textbook. Avoid his class
359746,Daniel Chiu,University of Washington,1530,CHEM152,2.0,"Mar 19th, 2013","DONT TAKE HIS CLASS! He just reads off the slides which come directly from the book. His practice exams are nothing like the real thing and there's always one random question on each test. All the tests are free response (midterms - 6 questions, final - 12) Read the textbook and do all the challenge problems. Prepare for the worst..."
359746,Daniel Chiu,University of Washington,1530,CHEM152,1.0,"Feb 28th, 2013","Chiu don't even know what you're getting yourself into. Seriously he's awful, just reads off the slides. I had to teach myself the whole Chem 152 through the book. Chiu won't get a good grade."
359746,Daniel Chiu,University of Washington,1530,CHEM152,2.0,"Feb 27th, 2013","He's a nice guy, but he's just really really boring. Like it sometimes just sounds like rambling. Even if you come to lecture prepared, having gone over the material beforehand, it's hard to pay attention without zoning out. For comparison, I had Carroll for 142 and I thought her lectures were much better. Also, Chiu's tests are INSANE."
359746,Daniel Chiu,University of Washington,1530,CHEM152,2.5,"Feb 25th, 2013",he was terrible. his lectures are useless unless you already know what's going on; therefore unhelpful if you're actually trying to learn things during lecture. his tests are unreasonably hard and nothing at all like the practice midterm he gives.
359746,Daniel Chiu,University of Washington,1530,CHEM152,1.0,"Feb 6th, 2013",His exam is really really hard!!!!!!!!and lecture is so boring!!DON'T TAKE HIS CLASS!!
359746,Daniel Chiu,University of Washington,1530,CHEM152,3.0,"Apr 27th, 2012","Chiu is a nice guy, but I found his lectures to be very boring. He just reads off of his slides and takes forever going over simple examples. His exams are harder than the examples he uses in class and the homework, so make sure that you read the textbook and spend a little extra time doing practice problems from the book."
359746,Daniel Chiu,University of Washington,1530,CHEM152,1.5,"Mar 26th, 2012","Attending lectures was a waste of time. He skips over definitions and goes straight into examples. Very frustrating! Nice guy, but not the best prof. Read the book, do the worksheets, and do problems from the book. Don't bother with lecture. Slides are posted online anyway. On a positive note, he does allow ""cheat sheets"" on exams."
359746,Daniel Chiu,University of Washington,1530,CHEM152,3.0,"Mar 26th, 2012","Chiu is a boring lecturer, and without reading the textbook I would have had a hard time understanding what was going on. If you're willing to read the book, you'll be fine. If not, I'd find another prof."
359746,Daniel Chiu,University of Washington,1530,CHEM152,3.0,"Mar 26th, 2012","This was not too hard of a course, the grading on the tests was fairly difficult, it was all short answer. Dr. Chiu was fairly interesting, and was very funny at times. Overall the course was OK-Good."
359746,Daniel Chiu,University of Washington,1530,CHEM152,4.0,"Mar 15th, 2012","Lectures are essentially taken from the textbook. Same with the tests - do the problems in the textbook (and repeat them until you fully understand) to study. Though the lectures are pretty boring, he is much more helpful in office hours. Overall, his class was a good experience."
359746,Daniel Chiu,University of Washington,1530,CHEM152,4.5,"Feb 29th, 2012",do not go to lectures. go to office hours only and read the text book. do all the practice problems.... literally all of them and you will be fine. all of his exams have problems from the back of the book. practice. practice practice.
359746,Daniel Chiu,University of Washington,1530,CHEM152,2.5,"Jun 19th, 2011",Chiu was a very very boring lecturer - I would often wonder why I showed up to class in the first place. His tests (midterm + final) consistently had one question that was random and out of no where. So expect that every time. He lectures about nothing you couldn't get from the book.
359746,Daniel Chiu,University of Washington,1530,CHEM152,5.0,"Mar 16th, 2011","Seek his office hours! He is such a kind gentleman who answers all your questions to the best of his ability and knowledge. I truly respect him and thought an honor to be one of the 500 students in his class. Although I did not end the course with a stellar grade, I really enjoyed his teachings. Hope you do too!"
359746,Daniel Chiu,University of Washington,1530,CHEM152,1.0,"Mar 6th, 2011",I personally don't recommend him. He never pay attention to the class.He just read through the lecture notes. I think he only cares about his research. The only thing u can learn from his class is-learn everything by urself. It makes completely no difference whether u show up to the class cuz u can download lecture notes and read to urself
359746,Daniel Chiu,University of Washington,1530,CHEM152,2.5,"Mar 27th, 2010",As a person I think he must be pretty nice. But his tests were difficult. There was always at least one question that had some sort of trick to it that I completely missed or didn't realize. Don't expect to walk out with an easy A.
359746,Daniel Chiu,University of Washington,1530,CHEM152,1.5,"Mar 22nd, 2010","Extremely boring lectures! If you decide to take Chiu, Just read the book, do homework and some extra problems in the textbook. This will easily get you a 3.8. Midterms are easy, the final was a bit harder. Labs and homework are freebe grades."
359746,Daniel Chiu,University of Washington,1530,CHEM162,2.5,"Mar 18th, 2010",Chiu sucks. His tests are ridiculous. He asks questions that cover things we barely cover in class. He allows you to bring cheat sheets to exams but it doesn't help if you haven't had any examples of the problems that he asks you.
359746,Daniel Chiu,University of Washington,1530,CHEM152,3.0,"Mar 15th, 2009","His lectures are kind of boring but if you focus on the material that won't be hard to understand the dull ""thermodynamics""stuff.Histests are pretty fair and one thing about his test is you can bring a cheat note to the mid term and two to the finals,which is not usually allowed by other professors."
359746,Daniel Chiu,University of Washington,1530,CHEM152,2.5,"Dec 19th, 2008","His lectures are quite boring. He reads from lecture notes, which come from the book. His tests are straightforward but there was always at least one trick question that will come from only briefly mentioned concepts. The material itself is easy, but if you don't go to lecture then read the textbook and study in groups often. Quizzes are tough."
359746,Daniel Chiu,University of Washington,1530,CHEM152,4.5,"Nov 24th, 2008","A fairly decent prof. Lectures are at times dull, though good sense of humor, and funny analogies. Tests are fair, quizzes are not. Labs are THE dullest ever- not his fault. I knew some of the topics and before hand, and I thought he explained it poorly- i left confused even though i had a good grasp before hand. Read the text beforehand."
359746,Daniel Chiu,University of Washington,1530,CHEM152,4.5,"Oct 22nd, 2008","He is one of the better chem professors! Yes he is not particularly interesting to listen to, but he explains things clearly and the tests are not too ridiculously hard and/or long. He is a definite improvement over zoller from 142 imho :D"
359746,Daniel Chiu,University of Washington,1530,CHEM152,2.0,"Dec 15th, 2007",decent sense of humor. Hard like all other intro premed classes. low avg gpa. test hard. lectures a little boring. quizes hard. better than callis.
